book_id,comment_id,comment_username,comment_timestamp,comment_location,comment_rating,comment_content,comment_isuseful
1449351,3675861024,chariots of fir,1675257235,安徽,5,弟弟刚上初中，翻看他们的语文课本，迅哥的文章还在。他的文章存在于课本一天，我们的底色就仍未改变，这是新文学的第一声呐喊，如果能想到什么词，那便是“思想启蒙”吧。,0
1449351,3675850265,我是MT,1675256863,陕西,5,迅哥儿的书必须好评,0
1449351,3675797553,辰墨是金,1675254722,河南,5,看的好压抑，但先生就是先生！！,0
1449351,3618813147,百里奚,1675246951,四川,5,比起课本上的，端午节中描写的方玄绰至今还讽刺着大部分人,0
1449351,3675147168,摆烂冠军,1675220835,北京,5,先生的书 常看常新 每每读完总有新的感悟,0
1449351,3675100464,sarahbudavsky,1675217782,广东,5,鲁迅的文章越看越有味道。,0
1449351,3675053464,o柠檬o,1675213894,河北,5,不必多说 上学的时候读过 工作了以后也读过,0
1449351,3674653397,今天读书了没,1675176917,广东,5,经典永远屹立不倒,0
1449351,3674576650,山川明朗,1675174319,安徽,5,没的说,0
1449351,3674570794,独角长颈鹿,1675174112,北京,5,抛开政治、名人的光环，单纯的读鲁迅的文字，也觉得很有趣。,0
1449351,3674425531,樱宏志（刘成飞,1675168550,陕西,5,呐喊！！！！！！！！,0
1449351,3674352578,Farewell,1675164873,安徽,5,《狂人日记》之呐喊,0
1449351,3674118570,斯德哥尔摩的海,1675152106,上海,5,描写现实直观而真实，鲁迅先生的敏锐无人能及。,0
1449351,3674020258,娣姜的鱼,1675146548,山东,5,致死都爱鲁迅先生的文章。,0
1449351,3673907602,神秘的小猫咪A,1675140576,江西,5,最喜欢的鲁迅短篇小说全都收录在此,0
1449351,3331440957,joker,1675137992,山西,5,这一部收录的都是经典啊，狂人日记，孔乙己，故乡，药，阿Q……作者的文笔是真的好啊，每一部作品都企图唤醒旧社会的人们，每一部作品都展现出旧社会的样子，读起来真的是感觉置身于其中，既为那时的人们感到悲哀，又为作者企图唤醒他们奋劲呐喊的决心而感动……,0
1449351,3673842916,豆友Hgzaepazcw,1675136923,广东,5,先生千古,0
1449351,3673613279,脉脉不得语,1675111807,湖北,5,里面的所有故事，在过去被誉为经典，在现在“此内容因违规无法查看”,0
1449351,3673594878,hubble-bubble¾,1675107479,新疆,5,不必说，经典,0
1449351,3673516180,白岚子,1675099661,广东,5,该走的路，该看的的书，一点都不会少,0
1449351,3673380714,莉莉,1675094067,辽宁,5,值得去看的一本书，我挺喜欢的！,0
1449351,2929311551,木梓一茶,1675081732,四川,5,"从初中以来就反复看鲁迅，如今才打算从头到尾认真重读一遍，竟也与当初产生了许多不尽相同的感想。
初中高中还自诩最喜欢的作家是鲁迅，现在想来难免惭愧。

感受到了破土而生的力量，和悬而未决的痛苦。
描写的都是在辛亥革命前后苦苦挣扎小人物，浮沉于历史长河中。

精妙的比喻实在是太多了，仅摘录一处：“假如一间铁屋子，是绝无窗户而万难破毁的，里面有许多熟睡的人们，不久就要闷死了，然而是从昏睡入死灭，并不感到就死的悲哀。现在你大嚷起来，惊起了较为清醒的几个人，使这不幸的少数者来受无可挽救的临终的苦楚，你倒以为对得起他们么？”

然而鲁迅依然得出了自己的结论：“说到希望，却是不能抹杀的，因为希望是在于将来，决不能以我之必无的证明，来折服了他之所谓可有。”

为在寂寞里奔驰的勇士献上慰藉，是为呐喊。",1
1449351,3672655251,长白旧人,1675062950,辽宁,5,不愧是鲁迅先生,0
1449351,3672632971,迷糊桃🥝,1675061906,北京,5,为鲁迅专题教学细读文章，鲁迅先生的文章深刻而充满民族气节。,0
1449351,3672388588,做个人吧,1675049676,重庆,5,很遗憾，大学才读完这本书，虽然初中就要求我们读了。迅哥儿真的无可挑剔,0
1449351,3672078118,积极向上美羊羊,1675014255,重庆,5,你们没听见他在说什么吗？,0
1449351,3655076627,书佳,1674992278,内蒙古,5,建议有些人熟读背诵阿Q正传第四章,0
1449351,3671444403,随风,1674990996,浙江,4,最喜欢社戏,0
1449351,3671441845,以撒,1674990891,甘肃,5,救救孩子。。。,0
1449351,3671390000,颜诺凌,1674988818,河北,4,一个特立独行的人需要金钱来保持他的尊严，否则就只有被毁灭的份，人们是不能容忍一个穷光蛋的异类的。就象一个老姑娘要用钱保持她的高傲，否则就是耻辱。,0
1449351,3671268599,踏花寻竹坞-Tt,1674983351,湖南,5,无法想象在当时的年代，鲁迅先生开创先人之风，用明锐的洞察力，剖析现实黑暗，抨击封建腐朽，字字诛心……于笔下塑造出一个个可怜可恨、庸碌俗利的人物形象……一个“吃人”的社会，悲惨……,0
1449351,3670784860,a cool fish,1674960809,广东,5,一件小事☺️,0
1449351,3670613256,无味无谓无畏,1674944834,江苏,5,高中必读,0
1449351,3670579030,十七,1674936136,江西,4,我还没真正遇见鲁迅,0
1449351,3670344828,momo,1674922121,法国,5,终于把这本书又重读了…,0
1449351,3669226473,舍万人,1674918596,上海,5,鲁迅 yyds,0
1449351,3669158321,momo,1674880733,浙江,5,小学到大学读了好几遍，今年想再读一遍。小学的时候读了个一知半解，瞎模仿写了好多阴阳怪气的文章，把我们语文老师气到撕了我的作文簿。。。文字是有力量的,0
1449351,3668869611,k,1674863626,河北,5,是藏在书箱后的青酸钾,0
1449351,3668498745,汪恕有,1674833893,江苏,,我得找个女人……,0
1449351,3668444352,萧萧,1674832525,辽宁,5,"喜欢药，故乡、阿Q和社戏。
狂人日记里面只有吃人二字和“狮子的凶心，兔子的怯弱，狐狸的狡猾”。
阿Q把当时中国人的劣根性写活了，现在虽然是和平年代，遇到坏事儿看热闹的也不少，然而这个时代的是非对错也并不容易判断。",0
1449351,3668305448,来自星空的眷恋,1674828977,内蒙古,5,初中读的，现在重新翻看依然震撼,0
1449351,3667972764,hokori,1674818742,北京,5,那罗汉豆的滋味或许不会再有。,0
1449351,2498468219,文以载道,1674794160,内蒙古,5,"-2-5《狂人日记》
将来是容不得吃人的人...

2-5 《孔乙己》
我到现在终于没有见－大约孔乙己的确死了。

2-6 《药》
华夏。
2-7 《一件小事》
反省知识分子有的那种清高，逐渐增长的冷漠冷血，自以为看透了一切的自傲的反思。",0
1449351,3667243399,小泉,1674790435,广西,5,补标,0
1449351,3667071450,斋文,1674780273,英国,4,撇开时代谈鲁迅作品没有意义 课本中课堂上的鲁迅远没有长大后重读时鲜活 可惜小时候没遇到一个好的语文老师,0
1449351,3666808363,Lavoisier,1674752316,福建,5,有什么变化呢,0
1449351,3666728903,默尔索如是说,1674749948,北京,5,高三的时候读的,0
1449351,3666646569,寒渡,1674747823,四川,5,鲁迅小说集里的精粹,0
1449351,3378641420,大能猫爱吃鱼,1674746087,山东,5,一个特立独行的人需要金钱来保持他的尊严，否则就只有被毁灭的份，人们是不能容忍一个穷光蛋的异类的。就象一个老姑娘要用钱保持她的高傲，否则就是耻辱。,0
1449351,3666570744,疏瀹五藏,1674746072,浙江,5,"常看常新，常看常新。
每每经历更多再读呐喊彷徨也会有不一样的思考。
大抵是因为映射百年前的社会，不甚久远，有些生活琐事相比照仍很能共鸣。
先生笔触可谓犀利，确是一针见血。",0
1449351,3666242526,缩腿儿丫🍡,1674737669,中国香港,5,"譬如看见老辈威压青年，,在先是要愤愤的，但现在却就转念道，将来这少年有了儿孙时，大抵也要摆这架子的罢，便再设有什么不平了。又如看见兵士打车夫，在先也要愤愤的，但现在也就转念道，倘使这车夫当了兵，这兵拉了车，大抵也就这么打，便再也不放在心上了。",0
1449351,3666208907,晃荡者,1674736669,浙江,5,私以为小说最重要的不是故事，不是其他，而是文体。如果一个作者无法形成他自己独有的语言风格，读者不能一看文字就知道，“呀，这是他呀”，大体是不会太成功的。当然再鲜明的文体也有“好”“坏”之分，这里的好坏不是什么客观标准，我把它理解为读者主观的喜欢和不喜欢。鲁迅的文体就是独属于他的，令人惊叹喜爱的，其他人无法模仿的东西。再想到，他的文体还是在第一个对白话文小说写作的探索中产生的，再多的溢美之词也不为过。,0
1449351,3666037959,冰糖熊猫,1674731231,四川,5,他真的是勇士,0
1449351,3628430451,Stella,1674727828,山西,5,看着心里难受～ 孔乙己、单四嫂子、小栓、夏瑜、陈士成，每个人悲戚的命运都让人叹息。,0
1449351,3665517528,无眠,1674711364,河南,5,觉得他满身灰尘的后影刹时高大了，而且愈走愈大，须仰视才见。渐渐的又几乎变成一种威压，甚而至于要榨出皮袍下面藏着的“小”来。独有这件小事，总浮在我眼前，有时反更分明，叫我惭愧，催我自新，并且增长我的勇气和希望。,0
1449351,3664958742,拾荒,1674668239,浙江,5,"书名完美概括内核。
鲁迅先生在《故乡》一文中写道：“希望本是无所谓有，无所谓无的。这正如地上的路；其实地上本没有路，走的人多了，也便成了路。”我这样理解：其实希望本也是没有的，为之呐喊、奋斗、流血、牺牲的人多了，也便有了希望。
这和“铁屋之辩”的思想内核是一致的。钱玄同先生告诉迅哥儿说，只要有几个清醒的人起来了，只要更大声地呐喊、呼救、奔走相唤，总能唤起更多的人；起来的人多了，冲破铁屋的可能性就大了，希望自然就有了。
“众人拾柴火焰高。”",0
1449351,3664950161,哆啦A梦,1674667927,广东,5,初高中语文书上选的都是精品。,0
1449351,3664329359,额额额额额额,1674652839,陕西,5,凭什么不给五星,0
1449351,3664012058,超人爱吃肉,1674644145,内蒙古,5,你迅哥就是你迅哥,0
1449351,3663891611,六个哈,1674640638,安徽,5,挺好的,0
1449351,3663835627,why,1674638913,安徽,5,我是跟风狗,0
1449351,3663693328,咖啡不加糖,1674634545,广东,4,读罢，可叹鲁迅笔下的人物依然大量存在于世间，可鲁迅先生已经不在了。,0
1449351,3663544606,Siccy,1674629641,山东,4,好像年纪越大，越能体会到各中情感,0
1449351,3663407410,南库,1674625284,内蒙古,5,作为文学作品，鲁迅的文学水平简直太棒了，药一篇把围观的群众写成是鸭子这是有怎样的想象力，或者写新发芽的大小是米粒大小这样的比喻让人一下子就知道在什么样的季节，这本书的精妙绝伦简直难以写尽。太值得一读了，真的实在是写的太好了，这样的作家只能说是如同从石头里蹦出来的孙悟空一样少又弥足珍贵，难得的是还心系国家铁肩担道义，要呐喊出时代强音鼓舞那些囿于囚笼的年轻人，写的实在太好了。阿q正传也是，怎么吧麻木不仁和时代悲剧写的这么到位呢，真的是太好了,0
1449351,3660237770,威尔第的星期三,1674624819,河北,4,在姥姥家发现6年级的小表妹在大声朗读朝花夕拾，碰巧在大表妹书架上看到『呐喊』从小语文成绩不佳的我怎么会想到多少年后会拿鲁迅的书来读（笑）于是『鼓故乡』之类的内容又有了别的感受。短篇小说的故事总像把一些人的生活撕了个口子，让人窥探了他们生活的一小段，这本尤其有这种感觉。看完呐喊仿佛知道了很多耳熟能详的内容的出处。在某个特定时代下背景的创作，愚钝如我只能试图去体会，但总有一些亘古不变的人性。有趣。 （另外传出去 先生虐猫（不是）,0
1449351,3663119205,霸气侧漏,1674617198,河北,4,谁能想到现在会主动去阅读中学语文课本呢,0
1449351,3663059368,我不能吃小番茄,1674615155,四川,5,我能说什么？新年看看情况收一套全集。,0
1449351,3662909712,几力娃娃,1674605849,浙江,5,小时候喜欢看鲁迅的著作，其实并不怎么理解其中深意，大抵是为了能在写小作文的时候，用一些诸如“大抵”“罢”之类的词体现水平罢。,0
1449351,3662811979,www,1674587686,上海,5,有时过度强调鲁迅作品的思想性，会忘记他作品的文学性也是一流,0
1449351,3662387252,Flora.💛,1674573545,上海,5,古今人不相远,0
1449351,3661758859,Winnie11171001,1674558672,上海,5,在座的各位在迅哥儿面前都是渣渣,0
1449351,3661686934,植物阴凉,1674556496,四川,5,20年前，在学生时代。最喜欢的作家。没有之一。启蒙了我对人文的兴趣。买过他的全集，模仿他的文笔，无论是过去，现在或是未来，他都是唯一。他所有的作品都看过很多遍了。评价就不用评价了，欣赏就完事了。,0
1449351,3005004446,吴毅,1674555399,吉林,5,2023.01.24说实话看的似懂非懂，能感受到其间蕴藏的巨大力量，但却又无法准确把握。,0
1449351,3661271058,乐事小狗,1674543328,安徽,5,我通过呐喊 想让世人醒悟,0
1449351,3660973980,八分素食主义者,1674532592,安徽,4,先生是伟大的,0
1449351,2925020030,Merak,1674530149,山东,5,有些文字，的确痛到让人无法形容。鲁迅先生的短篇小说，精妙绝伦！！,0
1449351,3660518896,正义的来福灵,1674497164,广东,5,一声叹息,0
1449351,3660301618,LORRY,1674490368,江西,5,鲁迅的短篇小说集，唤醒那个年代多数人麻痹的心。 又想起那句，绝对的民主是绝对的独裁。,0
1449351,3659208258,Kjuly,1674465348,福建,,2021-09-05,0
1449351,3657130895,Even,1674403409,山东,4,🐰年第一本,0
1449351,3657218344,和小桀看电影吗,1674389491,山东,5,呐喊———,0
1449351,3657191596,修行者张引,1674388706,湖北,5,众生相，鲁迅的刻画真是入木三分，每一个形象的背后都是一个群体，有些即使是现在依然适用。,0
1449351,3656822278,暂停观光,1674377385,上海,5,《阿Q正传》常读常新，当真笔力万钧,0
1449351,3656760450,豆友5963624614,1674375320,四川,5,又在怀念迅哥儿,0
1449351,3656431722,纯爱战神,1674363764,湖南,5,只有那暗夜为想变成明天，却仍在这寂静里奔波。,0
1449351,3656372198,豆友1-HzHVw7nQ,1674361736,内蒙古,5,日常難眠，吃過藥後，本意讀個短篇以待藥力。隨手翻開了魯迅的短篇，越讀越心驚，越讀越無了睡意。從狂人日記到白光，讀罷。思緒複雜，從來就有便是對嗎？人應是吃人的，剝皮、片肉、剔骨、吸髓，至今如此。從故事新編到吶喊，從五四到如今。可喜過去有鬥士，可悲現在沒了。,0
1449351,3656249808,sofia,1674357132,河南,3,“这真是一代不如一代！”,0
